{
  "acknowledged": [],
  "broken_references": [],
  "changed_sources": [],
  "content_hash": "2cd81e53f9c756834f2fa88e8673a0ec0ca96e51283372043c839fe3f550742a",
  "evidence": [
    "changed_files",
    "impact_rules",
    "knowledge_map",
    "decision_index",
    "doc_reference"
  ],
  "generated_from": {
    "commit": "8d94da46f4d66486bbe28d5751f904b50f2f16d9",
    "contract_sha256": "e2d38b488a4ca250a5885b233696e33199164915f5d44cc46d0ca93fc2022bb4",
    "generated_at": "2026-08-28T10:54:42Z",
    "policy_sha256": "8d6b3014867a1e0f3b876f3daa1c0abf810b0a74402e9e09050b38ce84bef6a0",
    "worktree_dirty": true,
    "worktree_state": "WORKTREE"
  },
  "impacted_documents": [],
  "non_semantic_sources": [
    "docs/workstreams/amplai-loop-runtime-adoption/CURRENT_ITEM.md",
    "docs/workstreams/amplai-loop-runtime-adoption/KIT-DISTRIBUTION.md",
    "ocs/workstreams/amplai-loop-runtime-adoption/CURRENT_ITEM.md",
    "tools/amplai-loop-kit/CHECKSUMS.sha256",
    "tools/amplai-loop-kit/distribution/targets.json"
  ],
  "reason": "의미 변경 경로가 없다",
  "schema_version": "1.0",
  "semantic_change": false,
  "status": "NOT_APPLICABLE",
  "work_id": "ALR-007"
}
