{
  "acknowledged": [
    ".specify/memory/constitution.md",
    "docs/KNOWLEDGE-RULES.md",
    "docs/MEMORY-DOMAIN-MODEL.md",
    "docs/MESSENGER-PROPOSAL-CONTROL.md",
    "docs/PROJECT-PACK.md",
    "docs/PROPOSALS.md",
    "docs/ROADMAP.md",
    "docs/VERSIONING.md",
    "docs/VISION.md"
  ],
  "broken_references": [],
  "changed_sources": [
    "src/amplai_foundry/cli.py",
    "src/amplai_foundry/governance/ingress.py"
  ],
  "content_hash": "8dc251f768bb09d20788c2fe0bc8f74f4c31b61a3a808e4536adcc7c76b1f6d3",
  "evidence": [
    "changed_files",
    "impact_rules",
    "knowledge_map",
    "decision_index",
    "doc_reference"
  ],
  "generated_from": {
    "commit": "1a5ee1246c5241101c062e167a666feece449486",
    "contract_sha256": "345b934e267fc4429608ba779bf8322856e4e68e2a178fdb95f5e756f8af4ca5",
    "generated_at": "2026-08-30T16:24:41Z",
    "policy_sha256": "8d6b3014867a1e0f3b876f3daa1c0abf810b0a74402e9e09050b38ce84bef6a0",
    "worktree_dirty": true,
    "worktree_state": "WORKTREE"
  },
  "impacted_documents": [
    {
      "action": "acknowledge",
      "category": "runtime_design",
      "discovered_by": [
        "knowledge_map",
        "decision_index"
      ],
      "evidence": [
        ".ai-team/knowledge/map.json#constitution",
        ".ai-team/knowledge/decisions.index.json#amplai-constitution"
      ],
      "handled": true,
      "path": ".specify/memory/constitution.md",
      "reason": "keyword governance; active decision amplai-constitution",
      "state": "ACTIVE"
    },
    {
      "action": "acknowledge",
      "category": "architecture",
      "discovered_by": [
        "impact_rules"
      ],
      "evidence": [
        ".ai-team/policy/documentation.json#governance-to-messenger-docs"
      ],
      "handled": true,
      "path": "docs/MESSENGER-PROPOSAL-CONTROL.md",
      "reason": "governance or messenger behavior change",
      "state": "ACTIVE"
    },
    {
      "action": "acknowledge",
      "category": "architecture",
      "discovered_by": [
        "impact_rules"
      ],
      "evidence": [
        ".ai-team/policy/documentation.json#governance-to-messenger-docs"
      ],
      "handled": true,
      "path": "docs/PROPOSALS.md",
      "reason": "governance or messenger behavior change",
      "state": "ACTIVE"
    },
    {
      "action": "acknowledge",
      "category": "architecture",
      "discovered_by": [
        "knowledge_map"
      ],
      "evidence": [
        ".ai-team/knowledge/map.json#vision"
      ],
      "handled": true,
      "path": "docs/VISION.md",
      "reason": "keyword amplai",
      "state": "ACTIVE"
    },
    {
      "action": "supersede",
      "category": "decision",
      "discovered_by": [
        "doc_reference"
      ],
      "evidence": [
        "git grep -F src/amplai_foundry/cli.py"
      ],
      "handled": true,
      "path": "docs/workstreams/messenger-governance-closure-v3/BACKLOG.md",
      "reason": "문서가 src/amplai_foundry/cli.py 를 직접 언급",
      "state": "ACTIVE"
    },
    {
      "action": "supersede",
      "category": "decision",
      "discovered_by": [
        "impact_rules",
        "knowledge_map",
        "decision_index",
        "doc_reference"
      ],
      "evidence": [
        ".ai-team/policy/documentation.json#governance-to-messenger-docs",
        ".ai-team/knowledge/map.json#mgc-decisions",
        ".ai-team/knowledge/decisions.index.json#MGC-012",
        "git grep -F src/amplai_foundry/cli.py"
      ],
      "handled": true,
      "path": "docs/workstreams/messenger-governance-closure-v3/DECISIONS.md",
      "reason": "governance or messenger behavior change; keyword ingress; active decision MGC-012",
      "state": "ACTIVE"
    }
  ],
  "non_semantic_sources": [
    "docs/workstreams/messenger-governance-closure-v3/CURRENT_ITEM.md",
    "docs/workstreams/messenger-governance-closure-v3/DECISIONS.md",
    "ocs/workstreams/messenger-governance-closure-v3/CURRENT_ITEM.md",
    "tests/test_cli.py",
    "tests/test_slack_ack_boundary.py"
  ],
  "reason": "impacted document 6 건을 이번 Work 에서 모두 갱신했다",
  "schema_version": "1.0",
  "semantic_change": true,
  "status": "RESOLVED",
  "work_id": "MGC-012-P5-W15"
}
